{
    "advancedSettings": {
        "basic": {
            "arrayCloseReplacement": "_HMI_RESERVED_ARRAYCLOSE_",
            "arrayOpenReplacement": "_HMI_RESERVED_ARRAYOPEN_",
            "asteriskReplacement": "",
            "browseValueSubelements": false,
            "colonReplacement": "",
            "definitionNameMode": 0,
            "doublePointReplacement": "_HMI_RESERVED_DOUBLECOLON_",
            "forbiddenReferenceNodes": {
                "binaryNodes": [],
                "guidNodes": [],
                "integerNodes": [],
                "stringNodes": []
            },
            "ignoreNodes": {
                "binaryNodes": [],
                "guidNodes": [],
                "integerNodes": [],
                "stringNodes": []
            },
            "percentReplacement": "",
            "startPoint": {
                "binaryIdentifier": "",
                "guidIdentifier": "",
                "identifierType": 0,
                "integerIdentifier": 85.0,
                "namespaceIndex": 0.0,
                "stringIdentifier": ""
            },
            "verticalLineReplacement": ""
        }
    },
    "connectionSettings": {
        "basic": {
            "timeout": "PT10S"
        }
    },
    "namespaces": {},
    "securitySettings": {
        "basic": {
            "acceptAllServerCertificates": true,
            "acceptSelfSignedCertificates": true,
            "authEnabled": false,
            "certificateTrust": "",
            "clientCertificate": "",
            "clientPrivatekey": "",
            "globalPassword": "",
            "globalUser": "",
            "policyMode": "http://opcfoundation.org/UA/SecurityPolicy#None",
            "securityMode": 1,
            "useGlobalUaUser": true,
            "useHmiServerCertificate": false
        }
    }
}